{"joint_names": ["shoulder_pan_joint", "shoulder_lift_joint", "elbow_joint", "wrist_1_joint", "wrist_2_joint", "wrist_3_joint"], "gcode": {"points": 565}, "tcp": {"offset_m": [-0.01578, 0.05966, 0.055365000000000004], "offset_mm": [-15.78, 59.66, 55.365], "nozzle_axis_local": [0, 1, 0], "frame": "tool0", "target_axis_mode": "nozzle_down", "target_axis_summary": "safe tour, nozzle down"}, "visual_path": {"points": [[0.6854538731429048, -0.15807569557662285, 0.09334257109763706], [0.6854549076037051, -0.15807284093407306, 0.093845710008084], [0.6854559529480208, -0.1580699902858646, 0.09434885543466803], [0.6854569982769373, -0.15806713961042806, 0.09485200086378323], [0.6854580435902342, -0.1580642889061017, 0.09535514629282137], [0.6854590888856825, -0.15806143817252263, 0.09585829172296964], [0.6854601341622117, -0.1580585874084143, 0.09636143715185916], [0.6854611794149399, -0.1580557366105944, 0.09686458257966851], [0.6854622246526935, -0.15805288577731816, 0.09736772800678578], [0.6854632698597635, -0.15805003490475683, 0.09787087343227785], [0.6854643150503941, -0.15804718399267922, 0.09837401885406204], [0.6854653602082152, -0.1580443330360821, 0.09887716428050376], [0.6854664053398798, -0.15804148203245583, 0.09938030969871434], [0.6854674504411621, -0.15803863098215193, 0.09988345511459723], [0.6854684955114444, -0.15803577987579404, 0.10038660052590466], [0.685469540545933, -0.15803292871438143, 0.10088974593326046], [0.6854705855467846, -0.15803007748954598, 0.10139289133467176], [0.6854716384195692, -0.15802723863044238, 0.10189603529718405], [0.6854726839646065, -0.15802438829835094, 0.10239918067432448], [0.6854737295089778, -0.1580215379659395, 0.10290232605131269], [0.6854747750527386, -0.15801868763327104, 0.10340547142815662], [0.6854758205958591, -0.15801583730035754, 0.10390861680484258], [0.6854768661382846, -0.15801298696708624, 0.10441176218140995], [0.6854779116802352, -0.15801013663355185, 0.10491490755782112], [0.6854789572215305, -0.15800728629973682, 0.10541805293406487], [0.6854800027621832, -0.15800443596565164, 0.10592119831016908], [0.6854810483022794, -0.15800158563129246, 0.10642434368611539], [0.6854820938416307, -0.15799873529664893, 0.10692748906196364], [0.6854831393804178, -0.15799588496175926, 0.10743063443760215], [0.6854841849185825, -0.15799303462653558, 0.10793377981310953], [0.6854852304559864, -0.15799018429105532, 0.1084369251884435], [0.6854862759927793, -0.1579873339551913, 0.10894007056371109], [0.6854873215289866, -0.15798448361910222, 0.10944321593873632], [0.685488367064476, -0.15798163328269577, 0.10994636131366536], [0.6854894125992071, -0.15797878294596862, 0.11044950668835984], [0.6854904581332592, -0.15797593260895915, 0.11095265206292969], [0.6854915036666174, -0.1579730822716145, 0.11145579743736857], [0.6854925491994894, -0.15797023193433382, 0.11195894281165356], [0.6854935947318849, -0.15796738159678747, 0.11246208818571551], [0.6854946402633347, -0.15796453125891655, 0.11296523355977992], [0.6854946402633347, -0.15796453125891655, 0.11296523355977992], [0.6825891235402489, -0.15723495168744195, 0.11296321339744467], [0.6796835159152717, -0.15650535151231537, 0.11296117189986776], [0.6767779082831754, -0.15577575133674668, 0.1129591303984555], [0.6738723006526997, -0.15504615116168916, 0.11295708889681935], [0.670966693030165, -0.15431655098740144, 0.11295504739883877], [0.6680610854100839, -0.1535869508138651, 0.11295300590143281], [0.6651554777950331, -0.15285735064025044, 0.11295096440621057], [0.6622498701798648, -0.1521277504673254, 0.11294892291188251], [0.6593442625705934, -0.15139815029442333, 0.1129468814188008], [0.6564386549672007, -0.1506685501209018, 0.11294483992589924], [0.6535330473626807, -0.14993894994822143, 0.11294279843522678], [0.6506274397613988, -0.14920934977521805, 0.11294075694483433], [0.6477218321643754, -0.14847974960129962, 0.11293871545755892], [0.6448162245694739, -0.147750149427868, 0.11293667396933754], [0.6419106169741505, -0.14702054924516383, 0.1129346324816742], [0.639005009365047, -0.14629094898770045, 0.11293259099296057], [0.6360994017621288, -0.14556134873204085, 0.1129305495051206], [0.6331937941648468, -0.1448317484772755, 0.11292850801902132], [0.6302881865747929, -0.1441021482229967, 0.11292646653374497], [0.6273825789894438, -0.14337254796957552, 0.11292442504918847], [0.6244769714106777, -0.1426429477173807, 0.11292238356732037], [0.6215713638377081, -0.14191334746598577, 0.11292034208456031], [0.6186657562701319, -0.14118374721569243, 0.11291830060441832], [0.6157601487081801, -0.14045414696635367, 0.11291625912488495], [0.6128545411523215, -0.13972454671755347, 0.11291421764655027], [0.6099489336018736, -0.1389949464690151, 0.11291217616874961], [0.6070433260588535, -0.13826534622061448, 0.1129101346923979], [0.6041377185180317, -0.137535745973807, 0.1129080932174456], [0.6012321109844688, -0.136806145727717, 0.11290605174291586], [0.5983265034570208, -0.1360765454828774, 0.11290401026955027], [0.5954208959334659, -0.13534694523923663, 0.11290196879694009], [0.592515288415508, -0.13461734499667843, 0.1128999273256796], [0.5896096809042181, -0.1338877447552024, 0.1128978858550863], [0.5867040733976767, -0.13315814451504732, 0.11289584438553513], [0.5837984658961071, -0.13242854427561007, 0.1128938029167097], [0.5808928583998091, -0.1316989440378833, 0.11289176144872687], [0.5779872509088536, -0.1309693438014671, 0.11288971998215902], [0.5750816434222, -0.13023974356611506, 0.11288767851658686], [0.5721760359416458, -0.1295101433321163, 0.11288563705077417], [0.5692704284666973, -0.1287805430996089, 0.11288359558689134], [0.5663648209936518, -0.12805094286791902, 0.11288155412352903], [0.5634592135307988, -0.12732134263781805, 0.11287951266156246], [0.5605536060706579, -0.12659174240931015, 0.11287747120047904], [0.5576479986159514, -0.12586214218254277, 0.11287542973906273], [0.5547423911650565, -0.12513254195672624, 0.11287338827943239], [0.5518367837210792, -0.1244029417326345, 0.11287134682006644], [0.5489311762808307, -0.12367334151006329, 0.1128693053616514], [0.546025568847228, -0.12294374128899606, 0.11286726390476008], [0.5431199614171628, -0.12221414106975292, 0.1128652224486148], [0.5402143539940228, -0.12148454085265423, 0.11286318099281151], [0.5373087465758722, -0.12075494063634623, 0.11286113953809182], [0.534403139161861, -0.12002534042221435, 0.11285909808397813], [0.531497531755245, -0.11929574021012321, 0.11285705663070476], [0.5285919243797086, -0.11856613995361394, 0.11285501517742709], [0.5256863170322135, -0.11783653966163381, 0.11285297372375216], [0.5227807096976771, -0.11710693937039857, 0.11285093227200524], [0.5198751023763136, -0.11637733907794129, 0.11284889082046709], [0.5169694950618386, -0.11564773878542184, 0.1128468493708041], [0.5140638877645769, -0.11491813849363805, 0.11284480792116253], [0.5111582804766884, -0.11418853820132159, 0.11284276647326871], [0.508252673200783, -0.11345893791034142, 0.11284072502487236], [0.5053470659349979, -0.11272933761927854, 0.11283868357826325], [0.5024414586856993, -0.11199973732919126, 0.11283664213323856], [0.4995358514459785, -0.11127013704002525, 0.11283460068871992], [0.49663024422239155, -0.11054053675182335, 0.11283255924400767], [0.49372463700843067, -0.10981093646571818, 0.11283051780138112], [0.4908190298086973, -0.10908133617985544, 0.11282847635915985], [0.4879134226242872, -0.10835173589614194, 0.11282643491810701], [0.48500781545202865, -0.10762213561431425, 0.11282439347752843], [0.4821022082927383, -0.10689253533492724, 0.11282235203845857], [0.4791966011477892, -0.10616293505816685, 0.11282031060079814], [0.4762909940171356, -0.10543333478379732, 0.11281826916299444], [0.47338538690074516, -0.10470373451260162, 0.11281622772748014], [0.4704797797964704, -0.10397413424474904, 0.11281418629209856], [0.46757417270682816, -0.10324453397939207, 0.11281214485831717], [0.4646685656325647, -0.10251493371984899, 0.11281010342446143], [0.4617629585724436, -0.10178533346250537, 0.11280806199284257], [0.45885735152599316, -0.10105573320989815, 0.11280602056268538], [0.45595174449229287, -0.10032613296191681, 0.11280397913236972], [0.45304613747599104, -0.09959653272017929, 0.11280193770447675], [0.4501405304696373, -0.09886693248230347, 0.11279989627742332], [0.4472349234825203, -0.09813733225080887, 0.1127978548504034], [0.4443293165027116, -0.09740773202575648, 0.11279581342555511], [0.4414237095400081, -0.09667813180605404, 0.11279377200130208], [0.4385181025914527, -0.09594853159386071, 0.11279173057726649], [0.43561249565508514, -0.09521893138820281, 0.11278968915735729], [0.4327068887340945, -0.0944893311901423, 0.11278764773597963], [0.42980128182172467, -0.09375973100007029, 0.11278560631652482], [0.4268956749249709, -0.0930301308173839, 0.11278356489885702], [0.4239900680402097, -0.09230053064389795, 0.11278152348169757], [0.4210844611671062, -0.09157093047832646, 0.1127794820661491], [0.4181788543055093, -0.0908413303224189, 0.11277744065261486], [0.4152732474556235, -0.09011173017556012, 0.11277539923846666], [0.4123676406190207, -0.08938213003858833, 0.11277335782788583], [0.40946203378946205, -0.0886525299117249, 0.11277131641672884], [0.40655642697264777, -0.08792292979586364, 0.11276927500812604], [0.4036508201657336, -0.08719332968967708, 0.11276723360101883], [0.4007452133703355, -0.08646372959537237, 0.11276519219467403], [0.39783960657866113, -0.08573412951249501, 0.11276315078892327], [0.39493399979923755, -0.08500452944103615, 0.11276110938623524], [0.3920283930287196, -0.08427492938205265, 0.11275906798369559], [0.39202831034156477, -0.08427491256471115, 0.11275905367875641], [0.39202831034156477, -0.08427491256471115, 0.11275905367875641], [0.39202831034156477, -0.08427491256471115, 0.11275905367875641], [0.39202831034156477, -0.08427491256471115, 0.11275905367875641], [0.39202831034156477, -0.08427491256471115, 0.11275905367875641], [0.39202831034156477, -0.08427491256471115, 0.11275905367875641], [0.